{
  "acceptance_versions": [
    "2.1.0"
  ],
  "base_commit_sha": "a7fa5f3e5429660adb87f5b548fa95eaf0406fd4",
  "config_digests": [],
  "files": [
    {
      "digest": {
        "algorithm": "sha256",
        "encoding": "hex",
        "value": "c8149fe4596701fdaed2556e1b42834b313cf2314921f52d3903f56577cd89c6"
      },
      "path": ".github/workflows/f00-acceptance-gate.yml"
    },
    {
      "digest": {
        "algorithm": "sha256",
        "encoding": "hex",
        "value": "7073ec4c9b8fbac53ce1b87c5dee5d7b12affbb480bab1bd1a8702fc97210d64"
      },
      "path": ".github/workflows/independent-review-gate.yml"
    },
    {
      "digest": {
        "algorithm": "sha256",
        "encoding": "hex",
        "value": "ddea4f807985752ebf7411fa44dcd0ca602c0f432e9020100c450d0d5771d639"
      },
      "path": ".github/workflows/review-artifact-gate.yml"
    },
    {
      "digest": {
        "algorithm": "sha256",
        "encoding": "hex",
        "value": "412f68071c26e66bc058ca7a3dc8a926852f77c193c44ff792a1ee9fc9f73e98"
      },
      "path": ".github/workflows/root-layout-gate.yml"
    },
    {
      "digest": {
        "algorithm": "sha256",
        "encoding": "hex",
        "value": "86af53d9cfb25a61a0708b6cf5464a918f5595d9c3539f3ee74faf083ba2859c"
      },
      "path": ".github/workflows/spec-gate.yml"
    },
    {
      "digest": {
        "algorithm": "sha256",
        "encoding": "hex",
        "value": "01ba4719c80b6fe911b091a7c05124b64eeece964e09c058ef8f9805daca546b"
      },
      "path": ".hyai/.gitkeep"
    },
    {
      "digest": {
        "algorithm": "sha256",
        "encoding": "hex",
        "value": "11a4dc4069c4673c7a2c8681e9b2b8d190ac9e1c96cf8f030a2a2e99ce9d0a16"
      },
      "path": "LICENSE"
    },
    {
      "digest": {
        "algorithm": "sha256",
        "encoding": "hex",
        "value": "da7544e4c2b4f4e514fd1a73e2f7f359ba7c5818f5d28f0c3a252f58717f5cc9"
      },
      "path": "README.md"
    },
    {
      "digest": {
        "algorithm": "sha256",
        "encoding": "hex",
        "value": "b4402df1bb54a6e3b52b0c731e8ec11c454e157d53ff4ce9cf7cb7eac50ba081"
      },
      "path": "ROOT_LAYOUT_MANIFEST.json"
    },
    {
      "digest": {
        "algorithm": "sha256",
        "encoding": "hex",
        "value": "103a2df7d5c286eff0482ce44f3135212363dcf562f0ad7123586ad6c993a99f"
      },
      "path": "SECURITY.md"
    },
    {
      "digest": {
        "algorithm": "sha256",
        "encoding": "hex",
        "value": "01ba4719c80b6fe911b091a7c05124b64eeece964e09c058ef8f9805daca546b"
      },
      "path": "artifacts/.gitkeep"
    },
    {
      "digest": {
        "algorithm": "sha256",
        "encoding": "hex",
        "value": "01ba4719c80b6fe911b091a7c05124b64eeece964e09c058ef8f9805daca546b"
      },
      "path": "config/.gitkeep"
    },
    {
      "digest": {
        "algorithm": "sha256",
        "encoding": "hex",
        "value": "01ba4719c80b6fe911b091a7c05124b64eeece964e09c058ef8f9805daca546b"
      },
      "path": "docs/.gitkeep"
    },
    {
      "digest": {
        "algorithm": "sha256",
        "encoding": "hex",
        "value": "01ba4719c80b6fe911b091a7c05124b64eeece964e09c058ef8f9805daca546b"
      },
      "path": "evidence/.gitkeep"
    },
    {
      "digest": {
        "algorithm": "sha256",
        "encoding": "hex",
        "value": "01ba4719c80b6fe911b091a7c05124b64eeece964e09c058ef8f9805daca546b"
      },
      "path": "migrations/.gitkeep"
    },
    {
      "digest": {
        "algorithm": "sha256",
        "encoding": "hex",
        "value": "01ba4719c80b6fe911b091a7c05124b64eeece964e09c058ef8f9805daca546b"
      },
      "path": "policies/.gitkeep"
    },
    {
      "digest": {
        "algorithm": "sha256",
        "encoding": "hex",
        "value": "6aac111027899c356ed63eb02b2abe2a801f2073dd36bd1a1d27e295d254a1e1"
      },
      "path": "pyproject.toml"
    },
    {
      "digest": {
        "algorithm": "sha256",
        "encoding": "hex",
        "value": "3510dbbb1c3d9932357dd1d06c85502681fd526740bb3acdf2e0d2a74013c06d"
      },
      "path": "schemas/acceptance_contract.schema.json"
    },
    {
      "digest": {
        "algorithm": "sha256",
        "encoding": "hex",
        "value": "8717dee7ca3a62699ed84bcc7853ee9de7d16cb6179fb13cc74fb1b59d57b0d6"
      },
      "path": "schemas/acceptance_results.schema.json"
    },
    {
      "digest": {
        "algorithm": "sha256",
        "encoding": "hex",
        "value": "168157cdc4d39ad2532d8dec6abc5569815ad84fb309fdf47b3e881868def41d"
      },
      "path": "schemas/artifact_manifest.schema.json"
    },
    {
      "digest": {
        "algorithm": "sha256",
        "encoding": "hex",
        "value": "098a2d27df1da88cd33592947c1f0f29086de84367483857b43df692acc54e61"
      },
      "path": "schemas/authority_envelope.schema.json"
    },
    {
      "digest": {
        "algorithm": "sha256",
        "encoding": "hex",
        "value": "97fbef30038091e96b284e52f7c2d8440ff76d7772e2ca850496827424db7218"
      },
      "path": "schemas/authority_request.schema.json"
    },
    {
      "digest": {
        "algorithm": "sha256",
        "encoding": "hex",
        "value": "08ff47d33cbf17c881a0da6b34d785dbabbe479d5d31a7bd26665c29ea4541c4"
      },
      "path": "schemas/benchmark_suite.schema.json"
    },
    {
      "digest": {
        "algorithm": "sha256",
        "encoding": "hex",
        "value": "0314a6fd02cfc62e9ae75910b0c4c9fe466834156144d866997bda8b187bb9ed"
      },
      "path": "schemas/budget_envelope.schema.json"
    },
    {
      "digest": {
        "algorithm": "sha256",
        "encoding": "hex",
        "value": "a057d741aae6c9498021a33a2a9c928b496e3d2e7583a29d0c40ca8c7af63fc4"
      },
      "path": "schemas/canary_plan.schema.json"
    },
    {
      "digest": {
        "algorithm": "sha256",
        "encoding": "hex",
        "value": "dcff05ebec479300512b989b3fd2d43fe419363d8805bc702e5466d6ad762e7c"
      },
      "path": "schemas/capability_plan.schema.json"
    },
    {
      "digest": {
        "algorithm": "sha256",
        "encoding": "hex",
        "value": "4120e9d0da25ff9583a285ccdd1610f806ee0d33a05840f6c797aa1e19f0e557"
      },
      "path": "schemas/capability_spec.schema.json"
    },
    {
      "digest": {
        "algorithm": "sha256",
        "encoding": "hex",
        "value": "8820902d68ef8a2b37773595b70eebdccc5d46a338ac335a681a0dfa3bc99f38"
      },
      "path": "schemas/checkpoint.schema.json"
    },
    {
      "digest": {
        "algorithm": "sha256",
        "encoding": "hex",
        "value": "46e7eee894194ed2ca86253fed1ca49917892436c2d27faacc6debdb16755ead"
      },
      "path": "schemas/command_envelope.schema.json"
    },
    {
      "digest": {
        "algorithm": "sha256",
        "encoding": "hex",
        "value": "fabddf4888e4e6093ca928bdef0919351b4078a4c6ce6a2a8c9202aa5136ce1d"
      },
      "path": "schemas/common.digest.schema.json"
    },
    {
      "digest": {
        "algorithm": "sha256",
        "encoding": "hex",
        "value": "f68ad19c7f19f5cd327aab746be4c37e0aaa5b417fdaf60f04af9c555feaadc6"
      },
      "path": "schemas/common.principal.schema.json"
    },
    {
      "digest": {
        "algorithm": "sha256",
        "encoding": "hex",
        "value": "a6853bdafa8c14ab5dabf560da5797c65baffd4d0d1cb70cf23a10647a26a799"
      },
      "path": "schemas/compatibility_profile.schema.json"
    },
    {
      "digest": {
        "algorithm": "sha256",
        "encoding": "hex",
        "value": "c01e6920166c7fcb04ff7c4594e541c387d792ca821a428fc7d43907083b5e6f"
      },
      "path": "schemas/component_abi_manifest.schema.json"
    },
    {
      "digest": {
        "algorithm": "sha256",
        "encoding": "hex",
        "value": "22a62ac2d230a072bd20902f5f61d0effe41822581dfb09aa86797b4bd9207ae"
      },
      "path": "schemas/contract_registry_entry.schema.json"
    },
    {
      "digest": {
        "algorithm": "sha256",
        "encoding": "hex",
        "value": "58d3c5a9ef66df4a2797138efb3e74ab0d603bda1e78a3f7ddc20b87d7c7ea41"
      },
      "path": "schemas/data_retention_policy.schema.json"
    },
    {
      "digest": {
        "algorithm": "sha256",
        "encoding": "hex",
        "value": "50c62ca127534e788e576b9bdbf7d27225d47c574f941ac2336dc2c4c945e491"
      },
      "path": "schemas/decision_record.schema.json"
    },
    {
      "digest": {
        "algorithm": "sha256",
        "encoding": "hex",
        "value": "baf3eef65ef321f49ae099127eac861b009eae2ac50b1e92bee38de5ae9f1951"
      },
      "path": "schemas/delivery_contract.schema.json"
    },
    {
      "digest": {
        "algorithm": "sha256",
        "encoding": "hex",
        "value": "9f4d90ee1b345b6e275e0155f74acebc6be35e54acee0744c934a03a6a8d1d31"
      },
      "path": "schemas/delivery_readiness_record.schema.json"
    },
    {
      "digest": {
        "algorithm": "sha256",
        "encoding": "hex",
        "value": "f76d80c766e7bd74036c5fd2e2c6eb46a272813a6e6c1afcb5a3829ec6275627"
      },
      "path": "schemas/department_charter.schema.json"
    },
    {
      "digest": {
        "algorithm": "sha256",
        "encoding": "hex",
        "value": "a4935cf7f63cb33ce3259d18c55b72c38d89bdcde9912fadd37a43376ce60938"
      },
      "path": "schemas/disaster_recovery_plan.schema.json"
    },
    {
      "digest": {
        "algorithm": "sha256",
        "encoding": "hex",
        "value": "4955b1101ecfc550f7a98a989359d4dd697cf3903da61f91ba5a908f11d23d01"
      },
      "path": "schemas/evaluation_run.schema.json"
    },
    {
      "digest": {
        "algorithm": "sha256",
        "encoding": "hex",
        "value": "cc32c8e9bc0f623c02d35160bf6f0d11a6d096faf1ade6d664d44c6b76626d8d"
      },
      "path": "schemas/evaluation_spec.schema.json"
    },
    {
      "digest": {
        "algorithm": "sha256",
        "encoding": "hex",
        "value": "236c147ba4c9d8322a237fdd6ccc1c2c35b2291e2c5ed5533e9ebfdcefb9829d"
      },